id,user_id,entrydt,heading,notes
1,1,31/08/2025 00:00,My Creative Journey,"Sharing the ups and downs of my art, music, or writing."
2,2,30/08/2025 00:00,Thoughts & Musings,A glimpse into the ideas and inspirations behind my work.
3,3,29/08/2025 00:00,The Daily Grind,What a day in my life as a creative person looks like.
4,4,28/08/2025 00:00,Behind the Scenes,"See how I create my content, from concept to final product."
5,5,27/08/2025 00:00,Project Spotlight,A deep dive into a recent or ongoing project.
6,6,26/08/2025 00:00,Life Lately,Quick updates on what I'm up to and what's on my mind.
7,7,25/08/2025 00:00,Our Mission,Why we do what we do and the values that drive us.
8,8,24/08/2025 00:00,What We Offer,A breakdown of our services or products.
9,9,23/08/2025 00:00,Team Spotlight,Meet the people who make it all happen.
10,10,22/08/2025 00:00,Client Success Stories,How our clients have achieved their goals with our help.
11,11,21/08/2025 00:00,Industry Insights,Our perspective on the latest trends and news.
12,12,20/08/2025 00:00,Tips for Success,Actionable advice and a guide to help you get started.
13,13,19/08/2025 00:00,Join the Conversation,"Share your thoughts, questions, and experiences with the group."
14,14,18/08/2025 00:00,Upcoming Events,"Don't miss out on our next meeting, workshop, or hangout."
15,15,17/08/2025 00:00,Member Spotlight,Highlighting the amazing people in our community.
16,16,16/08/2025 00:00,Group News,Important updates and announcements you need to know about.
17,17,15/08/2025 00:00,The Story of Us,How this community started and where we're headed.
18,18,14/08/2025 00:00,Our Cause,The issue we're fighting for and why it matters.
19,19,13/08/2025 00:00,How You Can Help,"Ways to get involved, from volunteering to donating."
20,20,12/08/2025 00:00,The Latest Research,"New data, studies, and information on our topic."
21,21,11/08/2025 00:00,Personal Stories,Real people sharing their experiences and perspectives.
22,22,10/08/2025 00:00,Your Daily Dose of...,"A quick moment of inspiration, humor, or positivity."
23,23,09/08/2025 00:00,Let's Connect!,We'd love to hear from you. Drop a comment below!
24,24,08/08/2025 00:00,A Little About Me/Us,Who we are and what we're all about.
25,25,07/08/2025 00:00,What's Next?,A sneak peek at what's coming soon.
